uid;type;language;title;size;country;newspaper;issue;pages;nb_pages;relevance;year;is_on_front;date;persons_mentioned;locations_mentioned;content;access_right;content_provider;is_content_available;collections;[total:114,available:200]
GDL-1925-06-05-a-i0042;;fr;;993;CH;GDL;GDL-1925-06-05-a;3;1;0.0;1925;False;1925-06-05T00:00:00Z;J. Richard|m. Le Grand|m. Hôtels Bristol|Od Hôtel de Trient|Cle PfCCrH|C. Feller;Lausanne|Aigle|Milan|Suisse|Suisse|Sion|Sion|Sierre|Sierre|Bellevue|St-Luc|Sierre|Suisse|Bellevue|Victoria|Bellevue|Bellevue;"1055 m. au pied des Dents du Midi et Dent Blanche. Ligne du Simplon ; Chemin de fer électrique Aigle-Ollon-MontheyChampéry. Changement de train venant de Lausanne a Aigle, de Milan à st-Maurice. 27 juillet : championnats internationaux de tennis de la Suisse ; 24 août : Championnat du Valais. Hôtels : Dents du Midi, Suisse, Champêry, Beau-Séjour, Alpes, Valais. I o Rnuunrot Hôtel-Chalet de la Fout DUUltSlEl rét. Hôt. d'anc. renom. (Lac Lèm.) SéJ. d. rep. Od parc, foret, tehnis. pêche, canot. Sais, avril-octob. MflBfilUC Motel d <; I » Foret, 100 UJUnUlnj lits. Prix Fr. 8.50 a 11 sel. la charnu. 1350 m. Ouv .: 15 juin. Dem. prosp. Culs, franq. rep. J. Richard, pr. wmm 1350 m. Le Grand Hôtel 200 lits Demandez le prospectus. ciynnnT sur la ligne Martignv-CharinnnUl monix. AU. 1237 m. Hôtels Bristol. Fr. IL- Beloiseau, Fr. 9. — Flnhan't. Fr. 9. —. Orchestre. Mêdec. I As * "" * "" * E-l A M D E ? Y sur Martigny-Orsières. station alpestre LH v V » n ** mi ^ C ^, idéale a 1470 m. d'altitude. Centre pour excursions et ascensions variées. Bains. Pêche. Canotage. Tennis. Orchestre. Hôtels : Alpes et Lac, Creltex, Glacier, Orny, Beau-Site, Champex, Combin. TDIPUT (HOOm.) Charm. stat. sit. au miLni p. d. Olac. à 3 km. voit. stat. Chatelard. Centre d'excur. Garage. Od Hôtel de Trient, Hôt. des Alpes. Cinutmu Altitude îr. tio m. centre IlUlUIflI de 32 cols et excursions. Hôtel (larron — Hôtel « In Grand Combin.-Demandez prospectus. ClflU Hôtel de la Paix, lerord. Point OIUII dép. p. Arolla. Eau ch. et fr. d. t. lesch. Rest. ren. Gar. Memb. C. A. S. Auto et voit, à l'hôt. R. Quennoz, pr. PMU & H 3 V Hôtel des Alpes riUnnill (Vallée de Bagnes) Prix de pension Fr. 9. —àFr. 12. —. Eclairage électrique. F. Métroz, pr. FflEBTîSMV '' oint (lc l >-P- Châtelard UlfinilUiII et Chamonix. GdSt-Bernard. Hôt. Kluser & Poste Hôtel du Gd-St-Bernard. Pr. Gar. ÇlflRJ Grand Hôtel et Terminus. JlUil 1 er ord. Garage. Nouv. direct. Buffet de la Gare. Reslaur. Spécialités valaisannes. Truites. Crettaz VAL X > 9 H ES JE * ES INT SI Station C. F. F. Sion. Service autocar postal et privé Jusqu'à Evolène ÉVOLÉNE. 1378 m. : Hôtel Dent Blanche. Grand Hôtel. LA SAGE. 1600 m. : Hôtel de la Sage. AROLLA, 2000 m. : Hôtel Mont Collon. Grand Hôtel et Kurhaus. Demandez prospectus. Gd hôtel Dent d'Hérens. 1400 m Maison 1 er ord. App. av. bains. Gar. Cols. ren. Conf. Pens. d. Fr. 9. Prosp. fflayensdeSIon MayansdeSion ^ Sm ^ râ 1350 m. d'alt. Cuisine soig. Prix de pension Fr. 8 a 10. Auto post. a Sion. VAL d'ANNIVIERS Station C. F. F. Sierre. Service posjal par autos. — Sierre s Hôtel Bellevue, Hôtel Arnold. — St-Luc : Hôtel Cervln, Hôtel Bella-Tolla. — Crlmentz : Hôtel Becs de Bossons.. — Chandoiim Grand Hôtel. — Vissoie i Hôtel d'Anniviers, Hôtel Weisshorn — Zinal : Hôtel Diablons. H @ rîfana-Vermaia Ligne du Simplon ; reliée à Sierre par un funiculaire. Altitude 1500-1680 m. Station climntérinue la pins ensoleillée de Suisse. — Pêche. — Canotage. -Golf.-Tous les sports d'été et d'hiver. Superbe plateau boisé de 4 km. Prospectus par le Bureau Officiel de renseignements. Loèche-Bes-Bains Gemmi : 2329 m. — Station bain. d. mont. 1411 m. — Torrenthorn : 8003 m. Grandes sources thermales, 51°, de la SOCIETE DES HOTELS ET BAINS. Traitement des rhumatismes, goutte. Convalescence. — Orchestre. Chemin de Ter électrique dès Loôchc, C. F. F ., ligne dn Simplon. Loècîtë'les Bains EK 8 £. SK : 1411 m. Situât, unique. Jardin. Conf. Pension dep. Fr. 8. — Dem. prospect. Vallée de Tourieinugnc. Hôtel Schwarzhorn. Prosp. Tél. Sit. tranq. et agr. For, d'arolles. Fr. Jasger, pr. ÇfaMljn u 6 tcl Stalden et Buffet de JidiUtu la Gare. stat. term. p. auto, pourSaasFee, Zermatt. Garage. S. A. des Hôtels O. Kluser & S. Lagger. Hôtel Lœtschberg. Alt. fOPPEl Gare Goppensteln 1 Nouv. route carros 3. h. Prix mod. P. M. Lagger. çnaÇMB Hôtel Beau-Site. JiliEJTLL Maison d'anc. renom. Merv. sit. Belles chamb ., bonne cuis. Fam. In-Albon, A. Andenmaten, dir. SaasFee LaPer i ! oo m AIpes Grand Hôtel Bellevue et Dom. Prosp. S. A. Hôtels O. Kluser & s. Lagger. Z E iR B ¥ 8 A [T Altitude : IGÎO mètres Centre de tourisme incomparable au pied du Cervin avec la ligne électrique du Gornergrat (3136 mètres) la plus haute il ciel ouvert de l'Europe. ZERMATT HOTELS SEILER Mont-Cervin, Mont-Rose, Victoria, Beau-Site. Au-dessus de Zermatt : Hôtel RiiTelalp, Hôtel Lac Noir. 1000 lits. Conf. mod. Orchestre. Tennis. Prix modérés. 7 PHK 3 HTT Hote 's -suisse, Nation-ULLMUfll 1 Terminus et Bellevue. Situation superbe et tranq, tout confort. Prix mod. Saison 1 er mal-oct. stat. chem. de ter Zermatt. Hôtel Weisshorn, Centre ascensions. Séjour idéal. Nom h. promenades. Prix modérés KS 1 TPL BPI ÏH D'-'lsy m-«« pied du flUl Cn DCunar od gi. d'Aietsch, Vue magn. point dep. céleb. excur. et prom. Pens. IOàHfr. A. Klingele & Cle PfCCrH 1071 m. Hôtel des Alpes riUUI recom. pour séjour et passage. Cuisine, caves soignées. Prix modérés. Prospectus. C. Feller. 7 EBMHTT HOTELS DE LA LLnlHiïl I COMMUNE i Zermatterhof, Klffelb. et Kulm-Goniergrat. 3136 m. Prix m. Prosp. 7 PBI ¥ II ! TT Hôtel Gornergrat p. LLnlIlII 11 de la gare. Prêf. d. Suisses. Pension Alpina. Situât, ensoleil. et tranquille. Demandez prospectus. Hôtel Bellevue. Séjour de montagne Lac. ""Confort mod. Poste auto. Prosp. S. A. Hôtels O. Kluser & S. Lagger. EQŒRH R 1 EDERHLP Hôtel Jungfrau. 2 h. 1 / 2 de Flesch. SéJ. idéal. Centre d'exc. Famille E. Catlirein, propr. Cl PTCPII ni RPI UPflPIIP Hôtels An centre des passages du Grimsel et ubCloLu Kl DUlïU / Lllk Seller Furka. (Auto post.) Pins beau voyage. Quand vous vous rendez en Valais, eu que vous en revenez utilisez de préférence le chemin de fer du LŒTSGHBESG ligne de tourisme par excellence. ";OpenPrivate;SNL;y;local-YaqV7H-D-nv0APgO7;
GDL-1925-06-18-a-i0042;;fr;;982;CH;GDL;GDL-1925-06-18-a;3;1;0.0;1925;False;1925-06-18T00:00:00Z;J. Richard|m. Le Grand|m. Hôtels Bristol|m. Grand Hôtel|O. Feller;Lausanne|Aigle|Milan|Suisse|Suisse|Trient|Sion|Sion|Sierre|Bellevue|Sierre|Suisse|Bellevue|Victoria|Suisse|Bellevue;"1055 m. au pied des Dents du Midi et Dent Blanche. Ligne du SImplon ; Chemin de fer électrique Aigle-Ollon-Monthey-Champêry. Changement de train venant de Lausanne a Aigle, de Milan a St-Maurice. 27 juillet : Championnats internationaux de tennis de la Suisse ; 24 août : Championnat du Valais. Hôtels : Dents du Midi, Suisse, Champéry, Beau-Séjour, Alpes, Valais. I n Dnnnnrflf Hôtel-Chalet de la Foin DUlIVcICI rét. Hôt. d'auc. renom. (Lac Lém.) Séj. d. rep. Gd parc, forêt, tennis. péche, canot. Sais, avrll-octob. MflBfilUC """" te' °° Foret, 100 lllUllVlflJ lits. Prix Fr. 8.50 à 11 sel. la chamb. 1850 m. Ouv. : 15 Juin. Dem. prosp. Cuis, franc, rép. J. Richard, pr. Biens 1350 m. Le Grand Hôtel 200 lits Demandez le prospectus. PIUUHITT'tigne Martigny-Channnnui moniï. Alt. 1287 m. Hôtels Bristol, FT. 11 .- Iiclolsp. au, Fr. 9 .-Pinbant, Fr. 9. —. Orchestre. Mêdec. LAC CHA 8 V 8 PEX sur Martignv-Orsiôres. Station alpestre , idéale a 1470 m. d'altitude. Centre pour excursions et ascensions variées. Bains. Pêche. Canotage. Tennis. Orchestre. Hôtels : Alpes et Lac, Crettex, Glacier, Orny, Beau-Site, Champex, Combln. TDIPHT U 400 m.) Cliarm. stat. sit. au 1 HILn 1 p. d. G lac. & 3 km. voit. stat. Chàtelard. Centre d'excur. Garage. Gd Hôtel de Trient, Hôt. des Alpes. FMUNllV Altitude 1500 m. Centre rlUIUlflI de 82 cols et excursions. Hôtel Carron — Hôtel du Grand Combln.-Demandez prospectus. ÇJflU Hôtel delà Paix, lerord. Point Ollin dép. p. Arolla. Eau ch. et fr. d. t. lesch. Rest. ren. Gar. Metnb. C. A. S. Auto et voit, à l'hôt. R. Quennoz, pr. FIOHNHY Hôtel des Alpes (Vallée de Bagnes) Prix de pension Fr. 9. — à Fr. 12. —. Eclairage électrique. F. Métroz, pr. MHDTKHIV Point dé P- P- Chàtelard llinnilvIIT et Chamonix. Gd-St-Bernard. Hôt. Klnser de Poste Hôtel dn Gd-St-Bernard. Pr. Gar. Çinsj Grand Hôtel et Terminus. MIM 1 er ord. Garage. Nouv. direct. Buffet de la Gare. Restaur. Spécialités valaisannes. Truites. Crettaz. V AL I >'3 Ei ES JFt 3 E 3 3 > ar S Station C. F. F. Sion. Service autocar postal et privé jusqu'à Evolène ÉVOLÈNE, 1378 m. : Hôtel Dent Blanche. Grand Hôtel. LA SAGE. 1600 m. : Hôtel de la Sage. AROLLA, 2000 m. : Hôtel Mont Collon. Grand Hôtel et Kurhaus. Demandez prospectus. olayens — „. .- _ uEdIUU d'Hérens, 1400 m Maison 1 er ord. App. av. bains. Gar. Cuis, ren. Conf. Pens. d. Fr. 9. Prosp. fflayensfleSIonjTS ^ 1850 m. d'alt. Cuisine soig. Prix de pension Fr. 8 a 10. Auto post. à Sion. VAL d'ANNIVIERS Station C. F, F. Sierre. Service postal par autos. — SIerro : Hôtel Bellevue, Hôtel Arnold. — St-Lnc t Hôtel Cervin, Hôtel Bella-Tolla. —Crimentz s Hôtel Becs de Bossons. —Cbandolin t Grand Hôtel. — Vlssoie : Hôtel d'Anniviers, Hôtel Weisshorn — Zinal : Hôtel Diablons. M ® nians-¥ erm @ la Ligne du Simpion ; reliée à Sierre par un funiculaire. Altitude 1500-1680. m. Station climatérique la plus ensoleillée de Suisse. — Pêche. — Canotage .-Golf .- Tous les sports d'été et d'hiver. Superbe plateau boisé de 4 km. Prospectus par le Bureau Officiel de renseignements. Loèche-les-Bains Gemmi : 2829 m. —• Station bain. d. mont. 1411 m. — Torrenthorn : 8003 m. Grandes sources thermales, 51°, de la SOCIÉTÉ DES HOTELS ET BAINS. Traitement ; des rhumatismes, goutte. Convalescence. — Orchestre. Chemin de fer électrique dès Loèche. C. F. P ., ligne dn SImplon. loëcoe-les-Bains *? £ » £ ?» % !. 1411 m. Situât, unique. Jardin. Conf. Pension dep. Fr. 8. — Dem. prospect. Gnmen-ffleuten îeïïSS 3 S 5 Scbwarzborn. Prosp. Tél. Sit. tranq. et agr. For. d'arolles. Fr. Jaeger, pr. Cfallinn Hotel Stalden et Buffet de JIOlUcll la Gare. Stat. terni, p. auto, pour saas-Fee, zermatt. Garage. S. A. des Hôtels O. Kluser & S. Lagger. KIPPEL Hôtel Lœtscbberg. Alt. 1876 m. (Lcetschenthal. i Gare Goppenstein 1 h. Prix mod. Nouv. route carross. P. M. Lagger. SHHS-FEE Hôtel lieau-Site. Maison d'anc. renom. Merv. sit. Belles chamb ., bonne cuis. Fam. In-Albon, A. Andenmaten, dlr. Case Une La Perle des Alpes àaas ree isoo m. Grand Hôtel Bellevue et Dom. Prosp. S. A. Hôtels O. Kluser & S. Lagger. Z E Ril ¥ l A T' T Altitude Î « 010 mètres Centre de tourisme incomparable au pied du Cervin avec la ligne électrique du Gornergrat (3136 mètres) la plus haute à ciel ouvert de l'Europe. ZERMATT -- HOTELS SEILER Mtmt-Cervin, Mont-Rose, Victoria, Beau-Site. Au-dessus de Zermatt : Hôte 1 Riffelalp, Hôtel Lac Noir. 1000 lits. Conf. mod. Orchestre. Tennis. Prix modères. 7 FBWIWTT Hôtels Suisse, Nation. ilbLnlflfl 11 Terminus et Bellevue. Situation superbe et tranq ., tout confort. Prix mod. Saison 1 er mai-oct. DHUnH sta !-chem. de fer Zermatt. nJllWn Hôtel Weisshorn, Centre ascensions. Séjour idéal. Nomb. promenades. Prix modérés. HrtTPI RPI Tïl D 218 (l m-P | e (i du OUI LU DCuflfar Gd gl. d'Aletsch, Vue magn. point dep. cèlèb. excur. et prom. Pens. I 0 al 4 fr. A. Klingele & Cie PfCCrn 1071 m. Hôtel des Alpes riLOLIl recom. pour séjour et passage. Cuisine, caves soignées. Prix modérés. Prospectus. O. Feller. ZEBDlHTT RE HOTELS DE LA COMMUNE i ZermatterhoL RiOelh. et Kulm-Gornerprrat. 8186 m. Prix m. Prosp. 7 FBMÏÏTT Hôtel Gornerjjrrat p. bLIllllfl 11 de la gare. Préf. d. suisses. Pension Alpina. Situât, ensoleil. et tranquille. Demandez prospectas. SilfiPiOïl'Killlîî sôjomwle montagne Lac. Confort mod. Poste auto. Prosp. S. A. Hôtels O. Kluser & s. Lagger. EGGISHOSH 10 ERRLP Hôtel Jungrrau. 2 h. 1 /^ de Fieseh. Séj. Idéal. Centre d'exc. Famille E. Cathrein, propr. (SI PTCPH ai RPf UÉnPStP Hôtels Au centre des passages du Grimsel et ubClJLu cl DbbffLwLllb Seller Furka. (Auto post.) Plus beau voyage Quand vous vous rendez en Valais, ou que vous en revenez utilisez de préférence le chemin de fer du X. ŒTSGHBim @ ligne de tourisme par excellence. ";OpenPrivate;SNL;y;local-YaqV7H-D-nv0APgO7;
GDL-1925-06-24-a-i0041;;fr;;972;CH;GDL;GDL-1925-06-24-a;3;1;0.0;1925;False;1925-06-24T00:00:00Z;J. Richard|m. Le Grand|m. Hôtels Bristol|Cil DCulUir|L. JU|C. Feller;Lausanne|Aigle|Milan|Suisse|Suisse|Trient|Sion|Sion|Sierre|Sierre|Bellevue|Sierre|Suisse|Bellevue|Victoria|Suisse|Bellevue;"1055 m. au pied des Dents du Midi et Dent Blanche. Ligne du Simplon ; Chemin de fer électrique Aigle-Ollon-Monthey-Champéry. Changement de train venant de Lausanne a Aigle, de Milan à si-Maurice. 27 juillet : Championnats Internationaux de tennis de la Suisse ; 24 août : Championnat du Valais. Hôtels : Dents du Midi, Suisse, Champéry, Beau-Séjour, Alpes, valais. I a Bnimorot Bôlel-Chalet de la Foin DUUVclEl rét. Hôt. d'anc. renom. (Lac Lém.) SêJ. d. rep. Gd parc, forêt, tennis. pêche, canot. Sais, avril-octob. rYMDfilUC Hôtel do la Forêt, 100 UJUHVUM lits. Prix Fr. 8.50 & Il sel. la chamb. 1350 m. Ouv. : 15 juin. Dem. prosp. Cuis, franc, rép. J. Richard, pr. MORGINS 1350 m. Le Grand Hôtel 200 lits Demandez le prospectus. EIUUTJIIT sur la ligne Martlgny-Channnnui momx. AU. 1237 m. Hôtels Bristol, Fr. 11 .- Belolseaa, Fr. 9 .--Einiiuut, Fr. 9. —. Orchestre. Médec. IATrUANIDPY sur Martigny-Orsières. Station alpestre Ï-MQ l / nHIlirCA idéale a 1470 m. d'altitude. Centre pour excursions et ascensions variées. Bains. Pêche. Canotage. Tennis. Orchestre. Hôtels : Alpes et Lac, Crettex, Glacier, Orny, Beau-Site, Champex, Combln. FTDIFHT (1400 m.) Charm. stat. sit. au 1 nlL. il 1 p. d. Glac. a 3 km. voit. stat. Châtelard. Centre d'excur. Garage. Gd Hôtel de Trient, Hôt. des Alpes. FMNMnV Altitude 1500 m. Centre riUnUIlI de 82 cols et excursions. Hôtel Carron — Hôtel du Grand Combin.-Demandez prospectus. Çinu Hôtel de la Paix, lerord. Point JlUn dép. p. Arolla. Eau en. et fr. d. t. lesch. Rest. ren. Gar. Memb. C. A. S. Auto et voit, à l'hôt. R. Quennoz, pr. 10 NNHY Hôtel des Alpes (Vallée de Bagnes) Prix de pension Fr. 9. — àFr. 12. —. Eclairage électrique. F. Métroz, pr. MHDTIfiUV Point dô P' P- Châtelard liinnilVIIiI et Chamonix. Gd-St-Bernard. Hôt. Klnser & Poste Hôtel du Gd-St-Bernard. Pr. Gar. C | nU Grand Hôtel et Terminus. dlUIÏ 1 er ord. Garage. Nouv. direct. Buffet de la Gare. Restaur. Spécialités valaisannes. Truites. Crettaz V AL T 3 'a £ îII. £ iISrS Station C. F. F. Sion. Service autocar postal et privé jusqu'à Evolène EVOLÈNE. 1378 m. : Hôtel Dent Blanche. Grand Hôtel. LA SAGE. 1600 m. : Hôtel de la Sage. AROLLA, 2000 m. : Hôtel Mont Collon. Grand Hôtel et Kurhaus. Demandez prospectus. MayensdeSion ^ Hé ^ HK Maison 1 er ord. App. av. bains. Gar. Cuis. ren. Conf. Pens. d. Fr. 9. Prosp. MayensdeSion ^ ïro ^ r ^ : 1350 m. d'alt. Cuisine soig. Prix de pension Fr. 8 à 10. Auto post. à Sion. VAL d'ANNIVIERS Station C. F. F. Sierre. Service postal par autos. — Sierre i Hôtel Bellevue, Hôtel Arnold. — St-Lnc : Hôtel Cervin, Hôtel Bella-Tolla. — Crinieutz : Hôtel Becs de Bossons. — Chandolln : Grand Hôtel. — Vlssole : Hôtel d'Anniviers, Hôtel Weisshorn — 7 Jnal i Hôtel Planions. Montana-¥ © renaSa Ligne du Simplon ; reliée à Sierre par un funiculaire. Altitude 1500-1680 m. Station cllmatérlque la plus ensoleillée de Suisse. — Pêche. — Canotage. -Golf .- Tous les sports d'été et d'hiver, superbe plateau boisé de 4 km Prospectus par le Bureau Officiel de renseignements. Loèche-les-Bains Gemmi : 2329 m. — Station bain. d. mont. 1411 m. — Torrenthorn : 8003 m. Grandes sources thermales, 51°, de la SOCIÉTÉ DES HOTELS ET BAINS. Traitement des rhumatismes, goutte. Convalescence. — Orchestre. Chemin de fer électrique dès Loècho, C. P. P ., ligne du Simplon. Loècne-Ies-Bains « KSïïA 1411 m. Situât, unique. Jardin. Conf. Pension dep. Fr. 8. — Dem. prospect. Qraben-ffleldenEïï £ BXÏ Schwarzhorn. Prosp. Tél. Sit. tranq. ""et agr. For, d'arolles. Fr. Jseger, pr. Ctallfafl Hotel Stalden et Buffet de ûluJUcU la Gare. Stat. terni, p. auto, pour saas-Fee, Zermatt. Garage. S. A. des Hôtels O. Kluser & s. Lagger. Alt. 1876 m. (Lœtschenihal.) Gare Goppenstein 1 h. Prix mod. Nouv. route carross P. M. Lagger. KIPPPI n° LœtHcuberg. CTJMC CCD Hôtel Beau-Site. OIHIOTCL Maison d'anc. renom. Merv. sit. Belles chamb ., bonne cuis. Fam. In-Albon, A. Andenmaten, dlr. Saas Fee La *•&&** Grand Hôtel Bellevue et Dom. Prosp. S. A. Hôtels O. Kluser & s. Lagger. Z E R Ifl A T T Altitude : 1610 mètres Centre de tourisme incomparable au pied du Cervin avec la ligne électrique du Gornergrat (3136 mètres) la plus haute à ciel ouvert de l'Europe. ZERMATT-HOTELS SEILER Mont-Cervin, Mont-Rose, Victoria, Beau-Site. Au-dessus de Zermatt : Hôtel Riffelatp, Hôtel Lac Noir. 1000 lits. Conf. mod. Orchestre. Tennis. Prix modérés. National-Bellevue. Situation superbe et tranq, tout confort. Prix mod. Saison 1 er mal-oct. 7 FBÎYIJJTT Hôtels Suisse, LLnlllfl I 1 Terminus et DHIffiH Stat- chem. de fer Zermatt. nnnL / n Hôtel Weisshorn, Centre ascensions. Séjour idéal. Nomb. promenades. Prix modérés HflTPI DP F HI D 2180 m. au pied du IIUI Cil DCulUir Gd gl. d'Aletsch, Vue magn. point dep. célèb. excur. et prom. Pens. 10 & 14 fr. A. Kilngelc & Cie CjGPrSI 1071 m. Hôtel des Alpes 11 L. JU 1 recom. pour séjour et passage. Cuisine, caves soignées. Prix modérés. Prospectus. C. Feller. 7 EDMTÏTT HOTELS DE LA bCHulill 1 COMMUNE s Zermatterhof, Rlffelb. et Kulm-Gornergrat. 8136 m. Prix m. Prosp. 7 BDMHTT Hôtel Goruergrat p. CCnilin 1 1 de la gare. Prêf. d. suisses. Pension Alpina. Situât, ensolell. et tranquille. Demandez prospectus. 'Kllîm Hotel Bellevue. SlmplOn'nUIllI séjour de montagne Lac. Confort mod. Poste auto. Prosp. S. A. Hôtels O. Kluser & S. Lagger Hôtel Jungfrau. 2 h. 1 / 2 do Flesch. Sêj. idéal. DICnPDIlID Centre d'exc. Famille lULUCAflbr E. Cathreln, propr. ECGiSHORN Al CTCrii ni DBI UCiïPDR Hôtels Au centre des passages du Grimsel et UbClàin Cl DCuiLi / CnL Seller Furka. (Auto post.) Plus beau voyage. Quand vous vous rendez en Valais, ou que vous en revenez utilisez de préférence le chemin de fer du LŒTSGHBSRG ligne de tourisme par excellence. ";OpenPrivate;SNL;y;local-YaqV7H-D-nv0APgO7;
GDL-1925-06-30-a-i0045;;fr;;956;CH;GDL;GDL-1925-06-30-a;3;1;0.0;1925;False;1925-06-30T00:00:00Z;J. Richard|m. Le Grand|m. Hôtels Bristol|Gar Çlflll Grand|m. Grand Hôtel|Cil DCtlflbr|C. Feller;Lausanne|Aigle|Milan|Suisse|Trient|Sion|Sion|Sierre|Sierre|Bellevue|St-Luc|Sierre|Suisse|Bellevue|Victoria|Bellevue|Bellevue;"1065 m. au pied des Dents du Midi et Dent Blanche. Ligne du SImplon ; Chemin de fer électrique Aigle-Ollon-Monthey-Chamnéry. Changement de train venant de Lausanne a Aigle, de Milan à si-Maurice. 27 juillet ; Championnats internationaux de tennis de la suisse ; 24 août : Championnat du. Valais. Hôtels : Dents du Midi, Suisse, Champêry, Beau-séjour, Alpes, Valais. I n Bnnunrnt Hôtel-Chalet de la Font DUUtBlBI rét. Hôt. d'anc. renom. tLae Lèm.) sêj. d. rep. Gd parc, forêt, tennls. péche, canot, sais, avril-cctob. Ilélel de la Foret. 100 lits. Prix Fr. 8.50 à U seL la chamb. 1350 m. Ouv. : 15 juin. Dem. prosp. Cuis, franc, rép. J. Richard, pr. HHER. INS 1350 m. Le Grand Hôtel 200 lits Demandez 1 e prospectus. sur la ligne Marligny-Chamonix. Alt. 1237 m. Hôtels Bristol, Pr. 11 .- Beloiseao, Fr. 9. finiiuut. Fr. 9. —. Orchestre. Mêdec. sur Martigny-Orsières. Station alpestre idéale a 1470 m. d'altitude. Centre pour excursions et ascensions variées. Bains. Pêche. Canotage. Tennis. Orchestre. Hôtels : Alpes et Lac, Crettex, Glacier, orny, Beau-Site, Champex, Combla. LAC CHAIVIPEX TDIEUT (MOOm.) Charm. stat. sil. au • Udll p. d. Glac. à 3 km. voit. slat. Cnatelard. Centre d'excur. Garage. Gd Hôtel de Trient, Hôt. des Alpes. Altitude 1500 m. Centre de 32 cols et excursions. Ilolcl Carrou — Hôtel du Grand Combin.-Demandez prospectus. Cinil Hôtel delà Paix, lerord. Point jlUn dép. p. Aroila. Eau ch. et fr. d. t. lesch. Rest. ren. Gar. Memb. C. A. S. Auto et voit, à l'. hôt. R. Quennoz, pr. Hôtel des Alpes (Vallée de Bagnes) Prix de pension Fr. 9. — à Fr. 12. — Eclairage électrique. F. Mêtroz, pr. Point dép. p. Cnatelard et Chamonix. Gd-Sl-Bernard. Ilôt. Kluser & Poste Hôtel du Gd-St-Bernard. Pr. Gar Çlflll Grand Hôtel et Terminus. JlUIl 1 er ord. Garage. Nouv. direct. Buffet de la Gare. Restaur. Spécialités valaisannes. Truites. Crettaz VAL I >'H J 3 JFL ES IST S Station C. F .. F.. Sion.. Service autocar postal et privé jusqu'à Evolène fiVOLÈNU. 1378 m. : Hôtel Dent Blanche. Grand Hôtel. LA SAGE. 1600 m. : Hôtel de là Sage, AKOLLA, 2000 m. : Hôtel Mont Collon. Grand Hôtel et Kurhaus. Demandez prospeems. <> d hôtel Dent d'ilérens. 1100 m Maison 1 er ord. A pp. av. bains. Gar. Culs, ren. Cônf. Pens. d. Fr. 9. Prosp. fflayensfieSion Hôtel de la Forêt. Ijol. prom ., vuegr. 1850 "" m. d'alt. Cuisine soig. Prix de pension Fr. 8 à 10. Auto post. à Sion. VAL d'ANNIVIERS Station C. F. F. Sierre. Service postal par autos. — Sierre « Hôtel Bellevue, Hôtel Arnold. — St-Luc s Hôtel Cervin, Hôtel Bella-Tolla. — Crimentz : Hôtel Becs de Bossons. — Chandolia t Grand Hôtel. — Vlssole i Hôtel d'Anniviers, Hôtel Weisshorn — Zinal : Hôtel Diablons... Montana-Vermala Ligne du Simplon ; reliée à Sierre par un funiculaire. Altitude 1500-1680 m. Station climatérimie la plus ensoleillée de Suisse. — Pêche. — Canotage. -Golf.-Tous les sport » d'été et d'hiver. Superbe plateau boisé de 4 km Prospectus par le Bureau Officiel de renseignements. Loèche-les-Bains Gemml : 2829 m. — Station bain. d. mont. 1411 m. — Torrenthorn : 8008 m. Grandes sources thermales, 51°, de la SOCIÉTÉ DES HOTELS ET BAINS. Traitement des rhumatismes, goutte. Convalescence. — Orchestre. Chemin de fer électrique dès Loéciie, C. F. P ., ligne du Simplon. LoètUe les Bains JSsSSiïSL 1411 m. Situât, unique. Jardin. Conf. Pension dep. Fr. 8. — Dem. prospect. Vallée de Tour— ———____ lemagrne. Hôtel Schwarzhorn. Prosp. Tél. Slt. tranq. et agr. For, d'arolles. Fr. Jasger, pr. Hôtel Stalden et Buffet de la Gare. Stat. tenu. p. auto. pourSaasFee, Zermatt. Garage. S. A. des. Hôtels o. Kluser & s. Lagger. IflDDEI Hôtel Lœtschberg. Alt. nifrLD 1876 m. (Lœtschenthal.) Gare Goppenstein 1 Nouv. route carrosa h. Prix mod. P. M. Lagger. FfllEÇ CED Hôtel Beau-Site. dlHUTLC Maison d'anc. renom. Merv. sit. Belles chamb ., bonne cuis. Fam. In-Albon, A. Andenmaten, dir. Caac fea La Perle des AlpeB JduVrKe 1800 m. Grand Hôtel Bellevue et Dom. Prosp. S. A. Hôtels 0. Kluser & s. Lagger. Z ERWATT Altitude i 1 « VW > mètre » Centre de tourisme incomparable au pied du Cervin avec la ligne électrique du Gornergrat (. liai, mètres) la plus haute à, ciel otrrcrt de HBnrope).. ZERMATT HOTELS SEILER Mont-Cervln, Mont-Rose, Victoria, Beau-Site. Au-dessus de Zermatt : Hôtel Rlffelalp, Hôtel Lac Noir. 1000 lits. Conf. mod. Orchestre. Tennis. Prix modérés. ZHfflfflTT HVe, ! sui 8 fiC Natlon. il-Ternilnus et Bellevue. Situation superbe et tranq, tout confort Prix mod. saison 1 er raai-oct. Stat. chem. de fer Zermatt. Ilote ! Weisshorn, Centre ascensions. Séjour idéal. Nomb. promenades. Prix modérés. HflTPl DPI UI D 2180 m. au pied du OUI Cil DCtlflbr od gl. d'Aletsch, Vue magn. point dep. cêlèb. excur. et prom. Pens. loftHfr. A. KlingeleACie PfBCrn 1071 m. Hôtel de * Alpes I ILJLU recom. pour séjour et passage. Cuisine, caves soignées. Prix modérés. Prospectus. C. Feller. 7 PDMHTT HOTELS DE LA faCMllflll COMMUNE l Zermattcrhof, Ulflelb. et Knlm-Gornergrat. 3136 m. Prix m. FTOSp. 7 PDMÏITT Hôtel Gornergrirt p. LLnGin 11 de la gare, prêf. d. Suisses. Pension Alpina. Situât, ensoleil. et tranquille. Demandez prospectus. Hôtel Bellevue. Séjour de montagne Lac. 'Conrort mod. Poste auto. Prosp. 8. A. Hôtels 0. Kluser A S. Lagger. EGGISHORN Hôtel Jungfrau. 8 h. 1 / 2 de Fiesch. Sêj. Idéal. Centre d'exc. Famille E. Cathrein, propr. fil PTCm ni RFI WÉnPBP Hôtel * Au centre des passages du Grimsel et UiiL] JbU cl DLlitfL. S / LnL Seller Furka. {Auto post.) Plus beau voyage. Quand vous vous rendes en Valais, ou que vous en revenez utilisez de préférence le chemin de 1 erdu LŒ. TSGHBX. RG ligne de tourisme par excellence. ";OpenPrivate;SNL;y;local-YaqV7H-D-nv0APgO7;
