uid;type;language;title;size;country;newspaper;issue;pages;nb_pages;relevance;year;is_on_front;date;persons_mentioned;locations_mentioned;content;access_right;content_provider;is_content_available;collections;[total:114,available:200]
EXP-1920-07-08-a-i0103;;fr;m uébactes 8e praz-9e port;559;CH;EXP;EXP-1920-07-08-a;6;1;0.0;1920;False;1920-07-08T00:00:00Z;Val Ferret|Reuse de Saleinaz;Neuchâtel;"m uébactes 8 e praz-9 e port (D'un correspondant) Ainsi que l'a annoncé la < Feuille d'Avis de Neuchâtel >, le village de Praz-de-Fort (Val Ferret) vient de passer des journées pleines d'anxiété dues aux menaces de la Reuse de Saleinaz, subitement grossie par une débâcle d'eau et de blocs de moraine tombés du glacier d'Orny. Tous les touristes montant à la cabane de Saleinaz, qui appartient à la section neuchâteloise du C. A. S ., auront remarqué de l'autre glacier de Saleinaz, à droite du vertigineux clocher du Portalet, la longue pente ravinée que domine l'extrémité du glacier d'Orny. C'est l'avancée de ce glacier, provoquant la rupture subite de poches d'eau formées par l'eau de fusion ou de pluie dans les crevasses ou des canaux sous-glaciaires, qui est cause de tout le mal. L'eau, _précipitée avec fracas et une force inouïe, a entraîné avec elle des quantités énormes de pierres de toutes grandeurs, dépassant souvent plusieurs mètres cubes ; les blocs en se heurtant les uns contre les autres faisaient un bruit sourd de tonnerre mêlé à celui de l'eau mugissante. Par bonheur, le village est sépare des glaciers par la forêt du Frumion, qui â réussi à retenir dans une bonne mesure les trois débâcles qui se sont succédé les 24.30 juin. et 4 juillet, mais la belle forêt en a subi de gros dégâts sur une largeur dépassant souvent 100 mètres et une longueur de 2 kilomètres ; de nombreux mélèzes, grands comme nos plus beaux sapins, ont été déracinés et brisés ; beaucoup d'autres ont été abattus entre deux débâcles par les gens de Praz-de-Fort, ceux qui restent se dressent, l'écorce enlevée à leur base, au milieu d'un champ de pierre remplaçant le doux et vert tapis de mousse et de myrtilles _. Le sacrifice de la forêt n'a pas été vain puisque le village a été épargné, les dégâts se terminant à 50 mètres des premières maisons ; mais le danger ne sera écarté que lorsque le glacier aura terminé ses fantaisies, ce que cherche à prévoir ou à éviter M. Mercanton, de la commission glaciologique fédérale, qui s'est rendu sur place ces derniers jours. Peut-être quelques travaux du genre de ceux effectués au glacier d'Otemma, dans la vallée voisine de Bagnes, réussiront-ils à éviter de nouvelles débâcles. L'accès à la cabane de Saleinaz est impossible par l'ancien chemin à peu près complètement détruit ; la Reuse, momentanément calmée, ne coule plus dans son ancien lit, elle s'est divisée en deux bras principaux dont les rives ont par places plusieurs mètres de haut ; ce fut pour nous une partie difficile de parcourir la région dévastée, traversant le torrent sur les arbres tombés ou faisant des sauts de chamois de blocs en blocs ; avec le consentement des propriétaires intéressés, le chemin passera un certain temps sur la rive droite, au pied des Pointes de Planereuse ; l'accès à la cabane est actuellement déjà possible par là. Les hommes de la contrée se sont dépensés courageusement à construire des barrages formés de troncs de gros arbres, ne craignant pas l'eau, la pluie ou l'obscurité, pendant que les femmes des chalets les plus exposés déménageaient ce qui pouvait être sauvé. Il ne s'est heureusement pas produit d'accidents graves, et les alarmes, annoncées par les guets et le tocsin n'ont pas été le signal du malheur ";OpenPrivate;SNL;y;local-YaqV7H-D-nv0APgO7,local-YaqV7H-D-iWSq1iIq;
EXP-1920-09-16-a-i0028;;fr;A la montagne;158;CH;EXP;EXP-1920-09-16-a;2;1;0.0;1920;False;1920-09-16T00:00:00Z;M. Célestin Rouiller|guide Maurice Crettex;Lausanne;"A la montagne Une chute a r Aiguille Javelle M. Célestin Rouiller, tapissier, à Lausanne, marié, -père de deux enfants, était parti de Champex samedi, pour faire l'ascension de l'Aiguille Javelle (3434 m.) avec un touriste genevois. Les deux alpinistes passèrent la nuit à la cabane Dupuis, glacier d'Orny, et repartirent le dimanche matin. Est-ce à la montée ou à là"" descente que se produisit un accident ? On ne le sait pas encore. T es deux touristes firent une terrible chute. tans les rochers. En descendant avec une colonne d'alpinistes, le guide Maurice Crettex, de Champex, trouva le comipagnon de Rouiller gisant avec une jambe cassée et de multiples contusions. Il le chargea sur. son dos et le descendit à la cabane d'Orny. Puis il remonta pour chercher Rouiller. Il ne retrouva qu'un cadavre horriblement dé. chiqueté, le crâne ouvert. Le corps a été _xalt dans un sac et descendu à Orsières dans la soirée de mardi. ";OpenPrivate;SNL;y;local-YaqV7H-D-nv0APgO7;
EXP-1921-07-27-a-i0051;;fr;CROQUIS;638;CH;EXP;EXP-1921-07-27-a;4;1;0.0;1921;False;1921-07-27T00:00:00Z;;Trient|Trient|Lausanne;"CROQUIS i lie-soir tombe... Dans la cabane DUpuis, les touristes, encore surpris de l'état dans lequel ils ont trouvé le glacier d'Orny, discutent un ibrin des chances de réussite pour leur course du lendemain... En sourdine une dame entonne Je < Petit village > de _Daioroze et la cabane s'anime soudain — on chante... Tout lo répertoire y passe, cependant que par delà le plateau du Trient les brumes se dissipent et l'Alipe rosit .... Au loin le Combin et le Velan surgissent de la nu © brillante ; tout près le Portalet se profile, élégamment et, bordant 1 © plajeau du Trient, les Aiguilles Dorées, taillées à' coups de hache, rouges comme du cuivré poli ; la Grande Fourche, l'arête fantastique du Chardonnet et les Aiguilles du Tour îont un cirque merveilleux autour du glacier rose. Dans 'la cabane il îait sombre, près du poêle et contre la taché claire de la vitre la tête de Joris se. profile, pipe aux dents, le chapeau inséparable de son chef. Il enlève, pour se joindre aux chants, sa pipe et on entend, parmi les : voix dont l'accord est parfois douteux, son Organe d'une sonorité particulière... < lorsque dans la sombre nuit... > Puis la lune se lève... vert et bleu, le glacier brille, gelé, durci déjà, strié de crevasses noitiés. Les monts semblent pénétrer plus profon dément dans le vert sombre du ciel,'à leurs flancs leg plaques de neige brillent comme de l'argent— Allons, il fera beau demain... Encore < la Marseillaise > et < la Madelon > — c'est le 14 juillet — et— à la paille. Demain, l'état particulièrement mauvais cette année des glaciers et les _rifrraies formidables vont nous donner du travail, tendre notre attention et notre énergie pour vaincre ; il faut aller se reposer, malgaré le charme de l'heure... Bonsoir ! Bonne nuit ! Bonne course... Deux mots encore et le calme du sommeil emplit bientôt la cabane. H _tSur le glacier, la cordée * a largement sué. Les pruneaux secs ont finalement empâté la bouche de l'un, un autre commence, dit-il, à ¦ « cracher des étincelles !>, le troisième tâte son épiderme facial qui malgré la pommade, se tend sous le soleil et ibnlle, bien cuit et rouge ; un autre rejette, d'un coup de reins, son sac trop lourd qui M scie les épaules ; bref, aucun n'est parfaitement heureux ; il fait trop chaud Le premier, pour se préserver, porte une voilette ! ! et n'éprouve aucun mal de l'intense rayonnement du glacier. Du seuil de la cabane, un touriste anglais et ses guides regardent s'avancer la longue cordée. Par pure coquetterie le premier touriste enlève vivement sa voilette dès la--riïaaie passée, mais ,-arrivé à la cabane, il est immédiatement interrogé par le touriste : _^ -Ditesmoâ, Monsieur ; c / est vraiment bien une voilette pour lé glacier ? Vous m'avez bien intrigué tout à l'heure. J'ai cru que c'était une . © mme qui conduisait cinq messieurs à sa corde ! Mais quand j'ai vu vos longues jambes en passant la crevasse, j'ai vu que c'était un homme ! Alors c'est un bon système ce voile ? Oui ? Où vous procurez-vous cela ? — Chez la première modiste venue ! — Aoh I quand je vais à Lausanne, je achetai, aussi une voilette, mais je pense jaune ou r * _erte, ce serait mieux ! et quand vous me revoyez sur le glacier, Je porte aussi un voile. Le lendemain, sur la fenêtre de Saleinaz : < Décidément, je achetai aussi 'une voilette, _fe suis comme une langouste fraîchement bouillie ! et je voie, vous n'avez rien du tout et vous n'avez pas mis de pommade ! je suas convaincu, vous. me reverrez une fois dans la montagne avec une voilette Jaune 1 > G. T. ";OpenPrivate;SNL;y;local-YaqV7H-D-nv0APgO7;
EXP-1924-08-19-a-i0066;;fr;A la montagne;386;CH;EXP;EXP-1924-08-19-a;4;1;0.0;1924;False;1924-08-19T00:00:00Z;guide Maurice Joris|M. Maurice Joris|M. Maurice Joris|Maurice Joris;Lausanne|Paris|Sondrio;"A la montagne Sauvés par un guide. — On écrit de Champex à la < Tribune de Lausanne » : Le guide Maurice Joris, de Champex, se rendant de la cabane Dupuis aux aiguifies du Tour, aperçut sur le glacier d'Orny un sac et un piolet Pas de touristes aux alentours ; rien à l'horizon. Revenu à la cabane prendre des renseignements, il apprit de cinq touristes qui avaient fait l'ascension de l'aiguille de la Fenêtre de Saleinaz, que deux alpinistes avaient été aperçus par eux à l'aiguille de la Varappe où ils paraissaient en danger. En vain avaient-ils tenté de se porter à leur secours, la rimaie étant en mauvais état M. Maurice Joris aidé du remplaçant du gardien de la cabane, M. Parquet, partirent aussitôt au secours des malheureux touristes. MM. Levy et Bernard, de Paris, partis de la cabane Dupuis le 12 août, à 5 heures du matin, _= _> pour faire la traversée des Aiguilles dorées, tentèrent une descente sur Saleinaz ; ils ne purent mener à bien leur projet audacieux et force leur fut de remonter à l'aiguille de la Varappe où ils bivouaquèrent. Les deux touristes n'avaient rien mangé de 10 heures du matin le 12 août à 4 heures de l'après-midi le 13, surpris qu'ils furent dans leur ascension par la neige si fréquente cette année au-dessus de 3000 mètres. La tourmente avait rendu méconnaissable le chemin du retour... Sans l'apparition du guide et de son auxiliaire qui, pour atteindre l'endroit où se trouvaient les deux malheureux touristes, durent tailler de nombreuses marches dans la glace et vaincre mille difficultés, on aurait eu à déplorer un grave accident de l'Alpe déjà si meurtrière cette . Grâce à l'habileté et au sang-froid de Maurice Joris, les deux Français purent regagner la cabane Dupuis promptement. On juge de leur joie et de la reconnaissance infinie qu'ils marquèrent à leur valeureux guide et à son compagnon. Encore des touristes disparus. — On annonce de. Sondrio (Valteline) qu'un grave accident de montagne s'est produit. Quatre alpinistes milanais étaient partis mercredi pour effectuer l'ascension du Monte Disgrazia. Depuis lors on est sans aucune nouvelle des touristes. On pense que, surpris par les orages et le froid de ces derniers jours, ils auront succombé. Des colonnes de secours sont parties à la _recherche des excursionnistes. ";OpenPrivate;SNL;y;local-YaqV7H-D-nv0APgO7;
EXP-1932-09-24-a-i0151;;fr;Malgré une glissade de 150 mètres, un alpiniste n'est que légèrement b[...];183;CH;EXP;EXP-1932-09-24-a;8;1;0.0;1932;False;1932-09-24T00:00:00Z;touriste, M. Tissot;Monthey|Monthey|Monthey;"Malgré une glissade de 150 mètres, un alpiniste n'est que légèrement blessé -CHAMPEX, 24. — Trois touristes, un habitant de Monthey et deux Français ,- faisaient jeudi une excursion au glacier d'Orny et à la cabane Dupuis ; ils voulurent descendre sur le val Arpettaz par le col du Chamois. L'un d'eux, qui n'avait qu'une canne et des souliers trop peu ferrés, fit une glissade sur une pente de 150 mètres et vint s'abattre au pied d'une paroi de rochers. Ses deux camarades, qui n'avaient pas de corde, redescendirent à Champex où ils arrivèrent épuisés, vendredi matin à 3 heures, après s'être longtemps égarés. Une colonne de secours de six hommes se mit en route à 5 heures. A 9 heures, elle arrivait sur le lieu de l'accident. On croyait ne trouver qu'un cadavre. Fort heureusement, le touriste n'était que blessé et ses blessures ne mettent pas sa vie en danger. Il avait un pied et une main foulés et portait de nombreuses ecchymoses. Le malheureux touriste, M. Tissot, âgé d'une trentaine d'années, originaire de Monthey, a été transporté à l'infirmerie de Monthey. ";OpenPrivate;SNL;y;local-YaqV7H-D-nv0APgO7;
EXP-1937-08-21-a-i0084;;fr;5-5 21 VIII 37SH—!H5 Nouvelles de partout;449;CH;EXP;EXP-1937-08-21-a;6;1;0.0;1937;False;1937-08-21T00:00:00Z;apprenti boucher, Fritz Nellerln|M. Louis Couchepln|Col de Pordol|président Kemal Ataturk;SUISSE|Zurich|Espagne|Suisse|Bâle|Wahlen|Delémont|Gossau|Suisse;5-5 21 VIII 37 SH—! _H 5 Nouvelles de partout EN SUISSE * A Zurich, le tribunal militaire t condamné quatre Individus qui s'étalent rendus en Espagne pour combattre au sein des troupes gouvernementales puis étalent rentrera en Suisse. Dn charpentier, un maçon et un manœuvre ont été condamnés chacun à sept mois d'emprisonnement et trols ans de privation des droits civiques. Le quatrième accusé s'en tire avec quatre mois de prison et un an de privation des droits. civiques. * Un grave accident de la circulation s'est produit vendredi matin près de la clté-jardlns de Mùnchensteln (près d » Bâle). Un apprenti boucher, Fritz Nellerln, né en 1920, de Wahlen, canton de Berne, en service chez un boucher de Relnach, est entré en collision avec une automobile de Delémont alors qu'il débouchait d'une rue latérale dans la Alte Relnacherstrasso. L'apprenti, qui circulait à vélo, a été projeté en arrière et a été grièvement blessé. Il est mort alors qu'on le transportait à l'hôpital. + M. Louis Couchepln, Juge fédéral, est tombé dans une crevasse en traversant le glacier d'Orny au retour d'une excursion aux Aiguilles d'Argentlère. M. Couchepln a été retiré de sa fâcheuse position par un groupe de soldats, n a subi une forte commotion. * Jeudi soir, vers 10 heures, un motocycliste venant de la direction de Gossau (Saint-Gall) est entré dans le dernier groupe d'une compagnie de recrue » dans le quartier du _Breitfeld. Le motocycliste, un caporal et une recrue ont été grièvement blessés. A I.'ÉTRANGER * Un accident d'automobile s'est duit au Col de Pordol, dans les Dolomites, au passage des participants h la course automobile Llége-Rome-Llége, Une machine occupée par les Suisse » Dreyer et Hahn est sortie de la chaussée pour des causes encore indéterminées, Dreyer a été tué. tandis que son compagnon sortait indemne de l'accident. * Le vapeur grec Margarita _, du Plrée, 2187 tonneaux, a lancé, au large de la côte de Grolx (Morbihan), un radio signalant qu'une grosse vole d'eau s'est déclarée dans la cale avant. Le port de Lorlent a avisé le remorqueur « Zwarsee », au mouillage à Douarnenez. * Un récipient pour la purification du gaz a fait explosion aux usines Slegerland S. A ., & Wissen (province rhénane), vendredi, lors de la pose d'une nouvelle conduite de gaz. Dlx-hult ouvriers ont été gravement brûlés par la puissante flamme que l'explosion a allumée, l'un d'eux a été tué. * Le président Kemal Ataturk, les membres du gouvernement et le chef de d'état-major général sont brusquement rentrés à Stamboul. On croit savoil qu'un important conseil de cabinet aura lieu relativement à la situation créée par les attaques répétées d'un sous-marin mystérieux à l'entrée des Dardanelles. ;OpenPrivate;SNL;y;local-em-LTHDN3Mk-zg7cm4F4,local-YaqV7H-D-nv0APgO7;
